{
  "event_id": "10000000-0000-4000-8000-000000000004",
  "event_type": "tenant.membership.deactivated.v1",
  "event_version": 1,
  "producer": "tenancy",
  "tenant_id": "00000000-0000-4000-8000-0000000000a1",
  "aggregate_type": "tenant_membership",
  "aggregate_id": "20000000-0000-4000-8000-000000000002",
  "aggregate_version": 3,
  "occurred_at": "2026-08-10T00:00:00Z",
  "recorded_at": "2026-08-10T00:00:01Z",
  "correlation_id": "30000000-0000-4000-8000-000000000004",
  "causation_id": "40000000-0000-4000-8000-000000000004",
  "privacy_class": "internal",
  "payload": {
    "membership_id": "20000000-0000-4000-8000-000000000002",
    "status": "inactive"
  }
}
